chamber,leg,sed_num,date,speaker,id_persona,para_class,text,snippet
Camera,19,648,2026-04-22,ROGGIANI Silvia,308891,interventoVirtuale,"Non avete consentito a noi di affrontare nel merito e nel profondo un tema che è costitutivo - lo è anche per voi, perché siete al quarto decreto Sicurezza. Però per noi la propaganda e la sostanza hanno un valore diverso. Siamo al quarto decreto Sicurezza - è stato già detto molto su questo tema, dalle colleghe e dai colleghi -, con un fallimento ormai conclamato, dato dai dati che ci raccontano di un aumento dei reati. A voi però non basta: è diventato per voi un tema su cui continuare a fare quello che vi viene molto bene, cioè quelli di Governo da un lato e dall'altro quelli di opposizione. Persino dai banchi della maggioranza riuscite a fare opposizione e riuscite a fare le manifestazioni su temi - e ci tornerò nel mio intervento -, come quello della remigrazione, manifestazione che è stata fatta a Milano pochi giorni fa e che verrà fatta a Napoli, entrambe a sfregio di una data importantissima che abbiamo alle porte, il 25 aprile.","Non avete consentito a noi di affrontare nel merito e nel profondo un tema che è costitutivo - lo è anche per voi, perché siete al quarto decreto Sicurezza. Però per noi la propaganda e la sostanza hanno un valore diverso. Siamo al quarto decreto Sicurezza - è stato già detto mo…"
Camera,19,648,2026-04-22,ROGGIANI Silvia,308891,interventoVirtuale,"Voglio, invece, citare le manifestazioni di lotta e di governo della remigrazione fatte in Lombardia. In Lombardia, noi ci ritroveremo, nel 2035, senza 190.000 lavoratrici e lavoratori. E che il presidente della mia regione - una regione dove gli imprenditori chiedono più canali legali di ingresso, per poter avere delle persone che si occupano di noi, perché le lavoratrici e i lavoratori migranti lavorano nel campo della cura, nel campo della logistica, nel campo dell'edilizia, in campi dove le italiane e gli italiani non vogliono lavorare - dicevo, che il presidente della mia regione - sto chiudendo - fosse stato in piazza a parlare di deportazioni, francamente, per la regione che dovrebbe essere locomotiva d'Europa e d'Italia, mi fa inorridire (Applausi dei deputati del gruppo Partito Democratico-Italia Democratica e Progressista).","Voglio, invece, citare le manifestazioni di lotta e di governo della remigrazione fatte in Lombardia. In Lombardia, noi ci ritroveremo, nel 2035, senza 190.000 lavoratrici e lavoratori. E che il presidente della mia regione - una regione dove gli imprenditori chiedono più canali…"
Camera,19,648,2026-04-22,MANCINI Claudio,307481,interventoVirtuale,"Non potete governare l'Italia, essere il partito di maggioranza relativa che esprime la Presidente del Consiglio, inseguire Vannacci sul suo terreno, che è già inseguito dal Vicepremier il quale fa le manifestazioni sulla remigrazione cercando di imitare Vannacci, e allo stesso tempo proporvi come partito guida della Nazione.","Non potete governare l'Italia, essere il partito di maggioranza relativa che esprime la Presidente del Consiglio, inseguire Vannacci sul suo terreno, che è già inseguito dal Vicepremier il quale fa le manifestazioni sulla remigrazione cercando di imitare Vannacci, e allo stesso …"
Camera,19,648,2026-04-22,TABACCI Bruno,34580,interventoVirtuale,"Con la Bossi-Fini del 2002, una legge certamente piena di contraddizioni, riuscii - e ormai è passato così tanto tempo - comunque a mettere in campo, da presidente della Commissione attività produttive, l'unica regolarizzazione votata dal Parlamento che mise in regola 700.000 lavoratori extracomunitari, migranti irregolari. Io ho un orgoglio pieno di quella pagina parlamentare. Pensare oggi di speculare sul fenomeno delle migrazioni parlando di remigrazioni, invece di gestirle con umanità e realismo, purtroppo è la linea di un Governo senza visione complessiva.","Con la Bossi-Fini del 2002, una legge certamente piena di contraddizioni, riuscii - e ormai è passato così tanto tempo - comunque a mettere in campo, da presidente della Commissione attività produttive, l'unica regolarizzazione votata dal Parlamento che mise in regola 700.000 la…"
Camera,19,652,2026-04-30,BENZONI Fabrizio,308913,interventoVirtuale,"Ha fatto anche un altro esempio per raccontare come in Spagna la crescita sia molto diversa da noi per tanti fattori. Uno è quello energetico: hanno la fortuna di avere il nucleare, noi no. Il secondo è quello demografico e ha ragione, perché la demografia della Spagna dimostra un Paese in crescita, anche grazie a flussi migratori, anche di origine - come diceva lei - ispanica, quindi più facilmente accoglibili. Peccato che dobbiamo confrontarci, da un lato, con questa opinione - e quindi con la necessità di capire e comprendere come utilizzare anche i flussi migratori ai fini di aumentare la demografia per il futuro del nostro Paese - e, dall'altro, con chi nella sua maggioranza parla di remigrazione indiscriminata.","Ha fatto anche un altro esempio per raccontare come in Spagna la crescita sia molto diversa da noi per tanti fattori. Uno è quello energetico: hanno la fortuna di avere il nucleare, noi no. Il secondo è quello demografico e ha ragione, perché la demografia della Spagna dimostra …"
Camera,19,652,2026-04-30,ROGGIANI Silvia,308891,interventoVirtuale,"Dietro quei numeri, davvero, ci sono i sogni, le preoccupazioni, le speranze, il futuro di tante famiglie che ci sono qui, quelle di tanti giovani, che avete molto citato, che scelgono di andare all'estero, e li avete citati senza proporre alcuna soluzione. Quel “gelo demografico” che citate in premessa, ma che, poi, non affrontate, non lo affrontate sui giovani, non lo affrontate nemmeno con il grande tema, qui, anche questo, mai toccato, dei canali legali per l'immigrazione, come vi chiedono gli imprenditori, peraltro, gli imprenditori del Nord, Ministro, dove anche lei vive. De resto, il suo partito - che, per suo tramite, è il partito anche del Presidente in questo momento - ha scelto, nella mia città, Milano, di scendere in piazza per la remigrazione; per fortuna, lei non l'abbiamo vista. Almeno, su questo, ha deciso di non esserci, perché è non solo antistorico, ma è anche totalmente antieconomico.","Dietro quei numeri, davvero, ci sono i sogni, le preoccupazioni, le speranze, il futuro di tante famiglie che ci sono qui, quelle di tanti giovani, che avete molto citato, che scelgono di andare all'estero, e li avete citati senza proporre alcuna soluzione. Quel “gelo demografic…"
Camera,19,653,2026-05-05,IACONO Giovanna,308821,interventoVirtuale,"Chiedo al Governo di correggere gli errori, di rafforzare le politiche pubbliche e di restituire centralità ai territori troppo a lungo trascurati. Allora, con questa mozione, chiediamo alcuni impegni al Governo: di dare seguito a quanto contenuto nella mozione sul tema delle aree interne - la mozione Sarracino ed altri n. 1-00354, tra l'altro, approvata da questo Parlamento all'unanimità -, di modificare la legge n. 131 del 12 settembre 2025 per rivedere i criteri di classificazione dei comuni montani basati esclusivamente su parametri di altimetria e pendenza, di non definanziare progetti della SNAI, del ciclo di programmazione 2014-2020, di destinare l'intero ammontare delle risorse a misure di sviluppo socio-economico delle aree interne, di favorire lo sviluppo economico, in particolare nel settore turistico, nelle aree interne attraverso forme di fiscalità di vantaggio sugli immobili, di affrontare il tema dell'emigrazione giovanile come una vera emergenza nazionale, di contrastare proposte che danno seguito a interventi sulla cosiddetta remigrazione, di prevedere per gli interventi previsti nell'ambito della ZES unica Mezzogiorno un sistema premiale di incentivi per gli investimenti realizzati dalle imprese nelle aree classificate come SNAI e di adottare tutte le iniziative normative necessarie in materia di dimensionamento scolastico per evitare la chiusura delle scuole nei piccoli comuni e garantire il diritto all'istruzione a tutte e a tutti.","Chiedo al Governo di correggere gli errori, di rafforzare le politiche pubbliche e di restituire centralità ai territori troppo a lungo trascurati. Allora, con questa mozione, chiediamo alcuni impegni al Governo: di dare seguito a quanto contenuto nella mozione sul tema delle ar…"
